Category,Text
1,"I will cut thy throat, one time or other, in fair"
1,terms: that is the humour of it.
1,'Couple a gorge!'
1,That is the word. I thee defy again.
1,"O hound of Crete, think'st thou my spouse to get?"
1,"No; to the spital go,"
1,And from the powdering tub of infamy
1,"Fetch forth the lazar kite of Cressid's kind,"
1,"Doll Tearsheet she by name, and her espouse:"
1,"I have, and I will hold, the quondam Quickly"
1,"For the only she; and--pauca, there's enough. Go to."
1, the 
1,"Mine host Pistol, you must come to my master, and"
1,"you, hostess: he is very sick, and would to bed."
1,"Good Bardolph, put thy face between his sheets, and"
1,"do the office of a warming-pan. Faith, he's very ill."
1,"Away, you rogue!"
1,"By my troth, he'll yield the crow a pudding one of"
1,these days. The king has killed his heart. Good
1,"husband, come home presently."
1,and 
1,"Come, shall I make you two friends? We must to"
1,France together: why the devil should we keep
1,knives to cut one another's throats?
1,"Let floods o'erswell, and fiends for food howl on!"
1,You'll pay me the eight shillings I won of you at betting?
1,Base is the slave that pays.
1,That now I will have: that's the humour of it.
1,As manhood shall compound: push home.
1,They draw
1,"By this sword, he that makes the first thrust, I'll"
1,"kill him; by this sword, I will."
1,"Sword is an oath, and oaths must have their course."
1,"Corporal Nym, an thou wilt be friends, be friends:"
1,"an thou wilt not, why, then, be enemies with me too."
1,"Prithee, put up."
1,I shall have my eight shillings I won of you at betting?
1,"A noble shalt thou have, and present pay;"
1,"And liquor likewise will I give to thee,"
1,"And friendship shall combine, and brotherhood:"
1,"I'll live by Nym, and Nym shall live by me;"
1,Is not this just? for I shall sutler be
1,"Unto the camp, and profits will accrue."
1,Give me thy hand.
1,I shall have my noble?
1,In cash most justly paid.
1,"Well, then, that's the humour of't."
1,Re- 
1,"As ever you came of women, come in quickly to Sir"
1,"John. Ah, poor heart! he is so shaked of a burning"
1,"quotidian tertian, that it is most lamentable to"
1,"behold. Sweet men, come to him."
1,The king hath run bad humours on the knight; that's
1,the even of it.
1,"Nym, thou hast spoke the right;"
1,His heart is fracted and corroborate.
1,The king is a good king: but it must be as it may;
1,he passes some humours and careers.
1,"Let us condole the knight; for, lambkins we will live."
1,SCENE II. Southampton. A council-chamber.
1,and
1,"'Fore God, his grace is bold, to trust these traitors."
1,They shall be apprehended by and by.
1,How smooth and even they do bear themselves!
1,"As if allegiance in their bosoms sat,"
1,Crowned with faith and constant loyalty.
1,"The king hath note of all that they intend,"
1,By interception which they dream not of.
1,"Nay, but the man that was his bedfellow,"
1,"Whom he hath dull'd and cloy'd with gracious favours,"
1,"That he should, for a foreign purse, so sell"
1,His sovereign's life to death and treachery.
1,Trumpets sound.and Attendants
1,"Now sits the wind fair, and we will aboard."
1,"My Lord of Cambridge, and my kind Lord of Masham,"
1,"And you, my gentle knight, give me your thoughts:"
1,Think you not that the powers we bear with us
1,"Will cut their passage through the force of France,"
1,Doing the execution and the act
1,For which we have in head assembled them?
1,"No doubt, my liege, if each man do his best."
1,I doubt not that; since we are well persuaded
1,We carry not a heart with us from hence
1,"That grows not in a fair consent with ours,"
1,Nor leave not one behind that doth not wish
1,Success and conquest to attend on us.
1,Never was monarch better fear'd and loved
1,"Than is your majesty: there's not, I think, a subject"
1,That sits in heart-grief and uneasiness
1,Under the sweet shade of your government.
1,True: those that were your father's enemies
1,Have steep'd their galls in honey and do serve you
1,With hearts create of duty and of zeal.
1,We therefore have great cause of thankfulness;
1,"And shall forget the office of our hand,"
1,Sooner than quittance of desert and merit
1,According to the weight and worthiness.
1,"So service shall with steeled sinews toil,"
1,"And labour shall refresh itself with hope,"
1,To do your grace incessant services.
1,"We judge no less. Uncle of Exeter,"
1,"Enlarge the man committed yesterday,"
1,That rail'd against our person: we consider
1,it was excess of wine that set him on;
1,And on his more advice we pardon him.
1,"That's mercy, but too much security:"
1,"Let him be punish'd, sovereign, lest example"
1,"Breed, by his sufferance, more of such a kind."
1,"O, let us yet be merciful."
1,"So may your highness, and yet punish too."
1,"Sir,"
1,"You show great mercy, if you give him life,"
1,After the taste of much correction.
1,"Alas, your too much love and care of me"
1,Are heavy orisons 'gainst this poor wretch!
1,"If little faults, proceeding on distemper,"
1,"Shall not be wink'd at, how shall we stretch our eye"
1,"When capital crimes, chew'd, swallow'd and digested,"
1,"Appear before us? We'll yet enlarge that man,"
1,"Though Cambridge, Scroop and Grey, in their dear care"
1,"And tender preservation of our person,"
1,Would have him punished. And now to our French causes:
1,Who are the late commissioners?
1,"I one, my lord:"
1,Your highness bade me ask for it to-day.
1,"So did you me, my liege."
1,"And I, my royal sovereign."
1,"Then, Richard Earl of Cambridge, there is yours;"
1,"There yours, Lord Scroop of Masham; and, sir knight,"
1,"Grey of Northumberland, this same is yours:"
1,"Read them; and know, I know your worthiness."
1,"My Lord of Westmoreland, and uncle Exeter,"
1,"We will aboard to night. Why, how now, gentlemen!"
1,What see you in those papers that you lose
1,"So much complexion? Look ye, how they change!"
1,"Their cheeks are paper. Why, what read you there"
1,That hath so cowarded and chased your blood
1,Out of appearance?
1,I do confess my fault;
1,And do submit me to your highness' mercy.
1,To which we all appeal.
1,"The mercy that was quick in us but late,"
1,By your own counsel is suppress'd and kill'd:
1,"You must not dare, for shame, to talk of mercy;"
1,"For your own reasons turn into your bosoms,"
1,"As dogs upon their masters, worrying you."
1,"See you, my princes, and my noble peers,"
1,"These English monsters! My Lord of Cambridge here,"
1,You know how apt our love was to accord
1,To furnish him with all appertinents
1,Belonging to his honour; and this man
1,"Hath, for a few light crowns, lightly conspired,"
1,"And sworn unto the practises of France,"
1,To kill us here in Hampton: to the which
1,"This knight, no less for bounty bound to us"
1,"Than Cambridge is, hath likewise sworn. But, O,"
1,"What shall I say to thee, Lord Scroop? thou cruel,"
1,"Ingrateful, savage and inhuman creature!"
1,"Thou that didst bear the key of all my counsels,"
1,"That knew'st the very bottom of my soul,"
1,"That almost mightst have coin'd me into gold,"
1,"Wouldst thou have practised on me for thy use,"
1,"May it be possible, that foreign hire"
1,Could out of thee extract one spark of evil
1,"That might annoy my finger? 'tis so strange,"
1,"That, though the truth of it stands off as gross"
1,"As black and white, my eye will scarcely see it."
1,"Treason and murder ever kept together,"
1,"As two yoke-devils sworn to either's purpose,"
1,"Working so grossly in a natural cause,"
0,"I'm tired of following my dreams. I'm just going to ask them where they are going and meet up with them later. 	"
0,"Did you hear about the guy whose whole left side was cut off? He's all right now. 	"
0,"Why didn’t the skeleton cross the road? Because he had no guts. 	"
0,"What did one nut say as he chased another nut?I'm a cashew! 	"
0,"Where do fish keep their money? In the riverbank 	"
0,"I accidentally took my cats meds last night. Don’t ask meow. 	"
0,"Chances are if you' ve seen one shopping center, you've seen a mall. 	"
0,"Dermatologists are always in a hurry. They spend all day making rash decisions.	"
0,"I knew I shouldn't steal a mixer from work, but it was a whisk I was willing to take. 	"
0,"I won an argument with a weather forecaster once. His logic was cloudy... 	"
0,"How come the stadium got hot after the game? Because all of the fans left. 	"
0,"\""Why do seagulls fly over the ocean?\"" \""Because if they flew over the bay, we'd call them bagels.\"" 	"
0,"Why was it called the dark ages? Because of all the knights.	"
0,"A steak pun is a rare medium well done. 	"
0,"Why did the tomato blush? Because it saw the salad dressing. 	"
0,"Did you hear the joke about the wandering nun? She was a roman catholic. 	"
0,"What creature is smarter than a talking parrot? A spelling bee. 	"
0,"I'll tell you what often gets over looked... garden fences. 	"
0,"Why did the kid cross the playground? To get to the other slide. 	"
0,"Why do birds fly south for the winter? Because it's too far to walk. 	"
0,"What is a centipedes's favorite Beatle song?I want to hold your hand, hand, hand, hand... 	"
0,"My first time using an elevator was an uplifting experience. The second time let me down. 	"
0,"To be Frank, I'd have to change my name. 	"
0,"Slept like a log last night … woke up in the fireplace. 	"
0,"What do you call a female snake. misssssssss	"
0,"Why does a Moon-rock taste better than an Earth-rock? Because it's a little meteor. 	"
0,"I thought my wife was joking when she said she'd leave me if I didn't stop signing \""I'm A Believer\""... Then I saw her face. 	"
0,"I’m only familiar with 25 letters in the English language. I don’t know why. 	"
0,"What do you call two barracuda fish?A Pairacuda! 	"
0,"What did the father tomato say to the baby tomato whilst on a family walk? Ketchup. 	"
0,"Why is Peter Pan always flying? Because he Neverlands. 	"
0,"What do you do on a remote island? Try and find the TV island it belongs to. 	"
0,"Did you know that protons have mass? I didn't even know they were catholic. 	"
0,"Dad I’m hungry’ … ‘Hi hungry I’m dad 	"
0,"I was fired from the keyboard factory yesterday.I wasn't putting in enough shifts. 	"
0,"Whoever invented the knock-knock joke should get a no bell prize. 	"
0,"Wife: Honey I’m pregnant.Me: Well…. what do we do now?Wife: Well, I guess we should go to a baby doctor.Me: Hm.. I think I’d be a lot more comfortable going to an adult doctor. 	"
0,"Have you heard the story about the magic tractor? It drove down the road and turned into a field. 	"
0,"When will the little snake arrive? I don't know but he won't be long... 	"
0,"Why was Pavlov's beard so soft?Because he conditioned it. 	"
0,"Do I enjoy making courthouse puns? Guilty 	"
0,"Why did the kid throw the clock out the window? He wanted to see time fly! 	"
0,"Hear about the new restaurant called Karma? There’s no menu: You get what you deserve. 	"
0,"Why couldn't the kid see the pirate movie? Because it was rated arrr! 	"
0,"It was so cold yesterday my computer froze. My own fault though, I left too many windows open. 	"
0,"Man, I really love my furniture... me and my recliner go way back. 	"
0,"What did the traffic light say to the car as it passed? \""Don't look I'm changing!\"" 	"
0,"My son is studying to be a surgeon, I just hope he makes the cut. 	"
0,"Why did the man run around his bed? Because he was trying to catch up on his sleep! 	"
0,"What did one wall say to the other wall? I'll meet you at the corner! 	"
0,"Sometimes I tuck my knees into my chest and lean forward.That’s just how I roll. 	"
0,"I once lost a banana at court but then I appealed.	"
0,"Conjunctivitis.com – now that’s a site for sore eyes. 	"
0,"How many South Americans does it take to change a lightbulb? A Brazilian 	"
0,"I don't trust stairs. They're always up to something. 	"
0,"What do you call two guys hanging out by your window? Kurt & Rod. 	"
0,"Why was the robot angry? Because someone kept pressing his buttons! 	"
0,"Which is the fastest growing city in the world? Dublin' 	"
0,"A police officer caught two kids playing with a firework and a car battery. He charged one and let the other one off. 	"
0,"What do you call a snake who builds houses? A boa constructor! 	"
0,"What is the difference between ignorance and apathy?I don't know and I don't care. 	"
0,"I went to a Foo Fighters Concert once... It was Everlong... 	"
0,"Why did the sentence fail the driving test? It never came to a full stop. 	"
0,"Some people eat light bulbs. They say it's a nice light snack. 	"
0,"What's the difference between a rooster and a crow? A rooster can crow but a crow cannot rooster. 	"
0,"I went to the store to pick up eight cans of sprite... when I got home I realized I'd only picked seven up 	"
0,"I cut my finger chopping cheese, but I think that I may have grater problems. 	"
0,"Yesterday, I accidentally swallowed some food coloring. The doctor says I’m okay, but I feel like I’ve dyed a little inside. 	"
0,"When people are sad, I sometimes let them colour in my tattoos. Sometimes all they need is a shoulder to crayon. 	"
0,"Last night me and my girlfriend watched three DVDs back to back. Luckily I was the one facing the TV. 	"
0,"I got a reversible jacket for Christmas, I can't wait to see how it turns out. 	"
0,"What do you get when you cross a pig and a pineapple? A porky pine 	"
0,"What did Romans use to cut pizza before the rolling cutter was invented? Lil Caesars 	"
0,"Why did the banana go to the doctor? He was not \""peeling\"" well. 	"
0,"My pet mouse 'Elvis' died last night. He was caught in a trap.. 	"
0,"Never take advice from electrons. They are always negative. 	"
0,"Why are oranges the smartest fruit? Because they are made to concentrate.	"
0,"A girl once asked me what my heart desired, apparently blood, oxygen and neural messages were all wrong answers 	"
0,"Why is it always hot in the corner of a room? Because a corner is 90 degrees. 	"
0,"What did the beaver say to the tree? It's been nice gnawing you. 	"
0,"How do you fix a damaged jack-o-lantern? You use a pumpkin patch. 	"
0,"Why do cows not have toes? They lactose! 	"
0,"What did the late tomato say to the early tomato? I’ll ketch up 	"
0,"I have kleptomania, but when it gets bad, I take something for it. 	"
0,"I used to be addicted to soap, but I'm clean now. 	"
0,"When is a door not a door? When it's ajar. 	"
0,"I made a belt out of watches once... It was a waist of time. 	"
0,"Why did Mozart kill all his chickens? Because when he asked them who the best composer was, they'd all say \""Bach bach bach!\""	"
0,"This furniture store keeps emailing me, all I wanted was one night stand! 	"
0,"How do you find Will Smith in the snow?Look for fresh prints. 	"
0,"My sister bet me $15 that I couldn't build a car out of spaghetti. You should have seen the look on her face as I drove pasta. 	"
0,"My boss told me to have a good day... so I went home. 	"
0,"I just read a book about Stockholm syndrome. It was pretty bad at first, but by the end I liked it. 	"
0,"Why do trees seem suspicious on sunny days? Dunno, they're just a bit shady. 	"
0,"If at first you don't succeed, sky diving is not for you! 	"
0,"I'd like to start a diet, but I've got too much on my plate right now. 	"
0,"What did the drummer name her twin daughters? Anna One, Anna Two... 	"
0,"What kind of music do mummy's like? Rap 	"
0,"I remember when I was a kid, I opened my fridge and noticed one of my vegetables were crying. I guess I have some emotional cabbage. 	"
0,"What's large, grey, and doesn't matter? An irrelephant.	"
0,"Frankenstein enters a bodybuilding competition and finds he has seriously misunderstood the objective. 	"
0,"A book just fell on my head. I only have my shelf to blame. 	"
0,"What did the dog say to the two trees? Bark bark. 	"
0,"I've got a joke about vegetables for you... but it's a bit corny. 	"
0,"If a child refuses to sleep during nap time, are they guilty of resisting a rest? 	"
0,"Why can't your nose be 12 inches long? Because then it'd be a foot! 	"
0,"Have you ever heard of a music group called Cellophane? They mostly wrap. 	"
0,"What do you call a boy who stopped digging holes? Douglas. 	"
0,"What did the mountain climber name his son? Cliff. 	"
0,"Why should you never trust a pig with a secret? Because it's bound to squeal. 	"
0,"Why are mummys scared of vacation? They're afraid to unwind. 	"
0,"Whiteboards ... are remarkable. 	"
0,"What kind of dinosaur loves to sleep? A stega-snore-us. 	"
0,"What has three letters and starts with gas? A Car. 	"
0,"What’s Forest Gump’s Facebook password? 1forest1 	"
0,"What kind of tree fits in your hand? A palm tree! 	"
0,"Whenever the cashier at the grocery store asks my dad if he would like the milk in a bag he replies, ‘No, just leave it in the carton!’ 	"
0,"I used to be addicted to the hokey pokey, but I turned myself around. 	"
0,"How many tickles does it take to tickle an octopus? Ten-tickles! 	"
0,"Me: If humans lose the ability to hear high frequency volumes as they get older, can my 4 week old son hear a dog whistle?Doctor: No, humans can never hear that high of a frequency no matter what age they are.Me: Trick question... dogs can't whistle. 	"
0,"What musical instrument is found in the bathroom? A tuba toothpaste. 	"
0,"I can't take my dog to the pond anymore because the ducks keep attacking him. That's what I get for buying a pure bread dog. 	"
0,"My boss told me to attach two pieces of wood together... I totally nailed it! 	"
0,"What was the pumpkin’s favorite sport?Squash. 	"
0,"Recent survey revealed 6 out of 7 dwarf's aren't happy. 	"
0,"What do you call corn that joins the army? Kernel. 	"
0,"I've been trying to come up with a dad joke about momentum . . . but I just can't seem to get it going. 	"
0,"‘Put the cat out’ … ‘I didn’t realize it was on fire 	"
0,"Why don't skeletons ride roller coasters? They don't have the stomach for it. 	"
0,"Is there a hole in your shoe? No… Then how’d you get your foot in it? 	"
0,"Every night at 11:11, I make a wish that someone will come fix my broken clock. 	"
0,"Two muffins were sitting in an oven, and the first looks over to the second, and says, \""man, it’s really hot in here\"". The second looks over at the first with a surprised look, and answers, \""WHOA, a talking muffin!\"" 	"
0,"What's the difference between a guitar and a fish? You can tune a guitar but you can't \""tuna\"" fish! 	"
0,"Did you hear that the police have a warrant out on a midget psychic ripping people off? It reads \""Small medium at large.\"" 	"
0,"Why don't sharks eat clowns?Because they taste funny. 	"
0,"Just read a few facts about frogs. They were ribbiting. 	"
0,"Two satellites decided to get married. The wedding wasn't much, but the reception was incredible. 	"
0,"What do you call a fish with no eyes? A fsh. 	"
0,"What do you get if you put a duck in a cement mixer? Quacks in the pavement. 	"
0,"They tried to make a diamond shaped like a duck. It quacked under the pressure. 	"
0,"Where’s the bin? Dad: I haven’t been anywhere! 	"
0,"My wife said I was immature. So I told her to get out of my fort. 	"
0,"Why did the knife dress up in a suit? Because it wanted to look sharp 	"
0,"How do you make a water bed more bouncy. You use Spring Water 	"
0,"I considered building the patio by myself. But I didn't have the stones. 	"
0,"In my career as a lumberjack I cut down exactly 52,487 trees. I know because I kept a log. 	"
0,"Why do bears have hairy coats? Fur protection. 	"
0,"What do you get when you cross a bee and a sheep? A bah-humbug.	"
0,"What did one snowman say to the other snow man? Do you smell carrot? 	"
0,"\""Dad, do you think it's going to snow this winter?\"" \""I dont know, its all up in the air\"" 	"
0,"Why do bees hum? Because they don't know the words. 	"
0,"What do you call a troublesome Canadian high schooler? A poutine. 	"
0,"A magician was driving down the street and then he turned into a driveway. 	"
0,"Don't trust atoms. They make up everything. 	"
0,"If you walk into a forest and cut down a tree, but the tree doesn't understand why you cut it down, do you think it's stumped? 	"
0,"Where do bees go to the bathroom?The BP station. 	"
0,"What is the best way to carve? Whittle by whittle. 	"
0,"What's a ninja's favorite type of shoes? Sneakers! 	"
0,"Why did the tree go to the dentist? It needed a root canal. 	"
0,"It was raining cats and dogs the other day. I almost stepped in a poodle. 	"
0,"Why do bananas have to put on sunscreen before they go to the beach? Because they might peel! 	"
0,"What do you call a bee that lives in America? A USB. 	"
0,"I was wondering why the frisbee was getting bigger, then it hit me. 	"
0,"A farmer had 297 cows, when he rounded them up, he found he had 300 	"
0,"What's the difference between a hippo and a zippo? One is really heavy, the other is a little lighter. 	"
0,"I’ve got this disease where I can’t stop making airport puns. The doctor says it terminal. 	"
0,"Somebody stole my Microsoft Office and they're going to pay - you have my Word. 	"
0,"What concert costs only 45 cents? 50 cent featuring Nickelback. 	"
0,"I couldn't figure out how the seat belt worked. Then it just clicked. 	"
0,"What did the green grape say to the purple grape? BREATH!! 	"
0,"What do you call a dad that has fallen through the ice? A Popsicle. 	"
0,"Two parrots are sitting on a perch. One turns to the other and asks, \""do you smell fish?\"" 	"
0,"Bad at golf? Join the club. 	"
0,"I had a pair of racing snails. I removed their shells to make them more aerodynamic, but they became sluggish. 	"
0,"What do you call a pile of cats?A Meowtain. 	"
0,"How do hens stay fit? They always egg-cercise! 	"
0,"Can a kangaroo jump higher than the Empire State Building? Of course. The Empire State Building can't jump. 	"
0,"What do you give a sick lemon? Lemonaid. 	"
0,"What do you call an old snowman? Water. 	"
0,"I tried to milk a cow today, but was unsuccessful. Udder failure. 	"
0,"I just got fired from a florist, apparently I took too many leaves. 	"
0,"Why don’t skeletons ever go trick or treating? Because they have nobody to go with. 	"
0,"What does a female snake use for support? A co-Bra! 	"
0,"\""Dad, I'm cold.\"" \""Go stand in the corner, I hear it's 90 degrees.\"" 	"
0,"Child: Dad, make me a sandwich. Dad: Poof! You're a sandwich. 	"
0,"which flower is most fierce? Dandelion 	"
0,"Why are graveyards so noisy? Because of all the coffin. 	"
0,"What kind of bagel can fly? A plain bagel. 	"
0,"How many apples grow on a tree? All of them! 	"
0,"What do you call a careful wolf? Aware wolf. 	"
0,"I was just looking at my ceiling. Not sure if it’s the best ceiling in the world, but it’s definitely up there. 	"
0,"Why do valley girls hang out in odd numbered groups? Because they can't even. 	"
0,"\""My Dog has no nose.\"" \""How does he smell?\"" \""Awful\"" 	"
0,"What do you call a cow with no legs? Ground beef. 	"
0,"Why are snake races so exciting? They're always neck and neck. 	"
0,"Why did the half blind man fall in the well? Because he couldn't see that well! 	"
0,"As I suspected, someone has been adding soil to my garden. The plot thickens. 	"
0,"What do bees do after they are married? They go on a honeymoon. 	"
0,"If I could name myself after any Egyptian god, I'd be Set. 	"
0,"Why doesn't the Chimney-Sweep call out sick from work? Because he's used to working with a flue. 	"
0,"It’s hard to explain puns to kleptomaniacs, because they take everything literally. 	"
0,"It's difficult to say what my wife does, she sells sea shells by the sea shore. 	"
0,"Why did Dracula lie in the wrong coffin? He made a grave mistake. 	"
0,"What did one plate say to the other plate? Dinner is on me! 	"
0,"what do you call a dog that can do magic tricks? a labracadabrador 	"
0,"Doctor: Do you want to hear the good news or the bad news? Patient: Good news please. Doctor: we're naming a disease after you. 	"
0,"Atheism is a non-prophet organisation. 	"
0,"I tried to write a chemistry joke, but could never get a reaction. 	"
0,"I gave my friend 10 puns hoping that one of them would make him laugh. Sadly, no pun in ten did. 	"
0,"What do computers and air conditioners have in common? They both become useless when you open windows. 	"
0,"What do you call a monkey in a mine field? A babooooom!	"
0,"Scientists finally did a study on forks. It's about tine! 	"
0,"I cut my finger cutting cheese. I know it may be a cheesy story but I feel grate now. 	"
0,"How do you steal a coat? You jacket. 	"
0,"Why don't you find hippopotamuses hiding in trees? They're really good at it. 	"
0,"what happens when you cross a sheep with a kangaroo ? A woolly jumper! 	"
0,"I’m reading a book on the history of glue – can’t put it down. 	"
0,"Want to hear a joke about construction? Nah, I'm still working on it. 	"
0,"My friend told me that pepper is the best seasoning for a roast, but I took it with a grain of salt. 	"
0,"Just watched a documentary about beavers… It was the best damn program I’ve ever seen. 	"
0,"Why do choirs keep buckets handy? So they can carry their tune 	"
0,"Did you hear about the kidnapping at school? It's ok, he woke up. 	"
0,"I asked my date to go to the gym the other day. They never showed up. That's when I knew we wouldn't work out. 	"
0,"You will never guess what Elsa did to the balloon. She let it go. 	"
0,"Did you hear about the two thieves who stole a calendar? They each got six months. 	"
0,"Waking up this morning was an eye-opening experience. 	"
