Category,Text
0,"Why can't eggs have love? They will break up too soon. 	"
0,"You can't run through a camp site. You can only ran, because it's past tents. 	"
0,"They're making a movie about clocks. It's about time 	"
0,"I’ve just been reading a book about anti-gravity, it’s impossible to put down! 	"
0,"Archaeology really is a career in ruins. 	"
0,"Have you ever seen fruit preserves being made? It's jarring. 	"
0,"I was going to get a brain transplant, but I changed my mind 	"
0,"Have you heard about the owl sanctuary job opening? It’s all night shifts but they’re all a hoot over there. 	"
0,"I boiled a funny bone last night and had a laughing stock 	"
0,"Why can't you use \""Beef stew\"" as a password? Because it's not stroganoff. 	"
0,"Animal Fact #25: Most bobcats are not named bob. 	"
0,"What did the piece of bread say to the knife? Butter me up. 	"
0,"Why couldn't the lifeguard save the hippie? He was too far out, man. 	"
0,"They say Dodger Stadium can hold up to fifty-six thousand people, but that is just a ballpark figure. 	"
0,"Some people say that I never got over my obsession with Phil Collins. But take a look at me now. 	"
0,"Why did the girl smear peanut butter on the road? To go with the traffic jam. 	"
0,"It takes guts to be an organ donor. 	"
0,"The rotation of earth really makes my day. 	"
0,"How much does a hipster weigh? An instagram. 	"
0,"A woman is on trial for beating her husband to death with his guitar collection. Judge says, ‘First offender?’ She says, ‘No, first a Gibson! Then a Fender!’ 	"
0,"I saw an ad in a shop window, \""Television for sale, $1, volume stuck on full\"", I thought, \""I can't turn that down\"". 	"
0,"What kind of dog lives in a particle accelerator? A Fermilabrador Retriever. 	"
0,"I always wanted to look into why I procrastinate, but I keep putting it off.	"
0,"What's blue and not very heavy?Light blue. 	"
0,"Guy told me today he did not know what cloning is. I told him, \""that makes 2 of us.\"" 	"
0,"I was so proud when I finished the puzzle in six months, when on the side it said three to four years. 	"
0,"Where did you learn to make ice cream? Sunday school. 	"
0,"Coffee has a tough time at my house, every morning it gets mugged. 	"
0,"A quick shoutout to all of the sidewalks out there... Thanks for keeping me off the streets. 	"
0,"Where does Napoleon keep his armies? In his sleevies. 	"
0,"What's the difference between roast beef and pea soup. Anyone can roast beef, but nobody can pee soup. 	"
0,"Leather is great for sneaking around because it's made of hide. 	"
0,"What do you get if you cross a turkey with a ghost? A poultry-geist! 	"
0,"People are making apocalypse jokes like there’s no tomorrow. 	"
0,"What is the tallest building in the world? The library – it’s got the most stories! 	"
0,"What kind of magic do cows believe in? MOODOO. 	"
0,"What’s the longest word in the dictionary? Smiles. Because there’s a mile between the two S’s. 	"
0,"Why don't eggs tell jokes? They'd crack each other up 	"
0,"I just broke my guitar. It's okay, I won't fret 	"
0,"It's only a murder of crows if there's probable caws. 	"
0,"How many kids with ADD does it take to change a lightbulb? Let's go ride bikes! 	"
0,"Where do hamburgers go to dance? The meat-ball. 	"
0,"I invented a new word! Plagiarism! 	"
0,"Did you know that ghosts call their true love their ghoul-friend? 	"
0,"What do you call a cow with two legs? Lean beef. 	"
0,"What did the big flower say to the littler flower? Hi, bud! 	"
0," I never wanted to believe that my Dad was stealing from his job as a road worker. But when I got home, all the signs were there. 	"
0,"Why do pumpkins sit on people’s porches?They have no hands to knock on the door. 	"
0,"Who is the coolest Doctor in the hospital? The hip Doctor! 	"
0,"Why was ten scared of seven? Because seven ate nine. 	"
0,"What do you get when you cross a rabbit with a water hose? Hare spray. 	"
0,"I applied to be a doorman but didn't get the job due to lack of experience. That surprised me, I thought it was an entry level position. 	"
0,"I knew a guy who collected candy canes, they were all in mint condition 	"
0,"A boy dug three holes in the yard. When his mother saw, she exclaimed: \""well, well, well\"" 	"
0,"Why do nurses carry around red crayons? Sometimes they need to draw blood. 	"
0,"Why was the shirt happy to hang around the tank top? Because it was armless 	"
0,"Why does a chicken coop only have two doors? Because if it had four doors it would be a chicken sedan. 	"
0,"\""I'll call you later.\"" Don't call me later, call me Dad. 	"
0,"Why did the teddy bear say \""no\"" to dessert? Because she was stuffed. 	"
0,"I don't trust sushi, there's something fishy about it. 	"
0,"New atoms frequently lose electrons when they fail to keep an ion them. 	"
0,"Did you hear the one about the giant pickle?He was kind of a big dill. 	"
0,"Breaking news! Energizer Bunny arrested – charged with battery. 	"
0,"How many bones are in the human hand? A handful of them. 	"
0,"A red and a blue ship have just collided in the Caribbean. Apparently the survivors are marooned. 	"
0,"I've just written a song about a tortilla. Well, it is more of a rap really. 	"
0,"Can February march? No, but April may. 	"
0,"So a duck walks into a pharmacy and says \""Give me some chap-stick… and put it on my bill\"" 	"
0,"Egyptians claimed to invent the guitar, but they were such lyres.﻿ 	"
0,"Toasters were the first form of pop-up notifications. 	"
0,"What is a witch's favorite subject in school? Spelling! 	"
0,"What do you call a crowd of chess players bragging about their wins in a hotel lobby? Chess nuts boasting in an open foyer. 	"
0,"Which side of the chicken has more feathers? The outside. 	"
0,"Remember, the best angle to approach a problem from is the \""try\"" angle. 	"
0,"Why are fish easy to weigh? Because they have their own scales. 	"
0,"What did the scarf say to the hat? You go on ahead, I am going to hang around a bit longer. 	"
0,"Did you hear about the scientist who was lab partners with a pot of boiling water? He had a very esteemed colleague. 	"
0,"This morning I was wondering where the sun was, but then it dawned on me. 	"
0,"Writing with a broken pencil is pointless. 	"
0,"What did the sea say to the sand? \""We have to stop meeting like this.\"" 	"
0,"Why is it so windy inside an arena? All those fans. 	"
0,"A panda walks into a bar and says to the bartender \""I’ll have a Scotch and . . . . . . . . . . . . . . Coke thank you\"". \""Sure thing\"" the bartender replies and asks \""but what’s with the big pause?\"" The panda holds up his hands and says \""I was born with them\"" 	"
0,"I've started telling everyone about the benefits of eating dried grapes. It's all about raisin awareness. 	"
0,"\""Doctor, I’ve broken my arm in several places\"" Doctor \""Well don’t go to those places.\"" 	"
0,"Where was the Declaration of Independence signed?At the bottom!	"
0,"What’s the difference between an African elephant and an Indian elephant? About 5000 miles. 	"
0,"Two peanuts were walking down the street. One was a salted 	"
0,"Don’t interrupt someone working intently on a puzzle. Chances are, you’ll hear some crosswords. 	"
0,"Today a man knocked on my door and asked for a small donation towards the local swimming pool. I gave him a glass of water. 	"
0,"What did the Zen Buddist say to the hotdog vendor? Make me one with everything. 	"
0,"Why did the clown have neck pain? - Because he slept funny 	"
0,"What did the digital clock say to the grandfather clock? Look, no hands! 	"
0,"A weasel walks into a bar. The bartender says, \""Wow, I've never served a weasel before. What can I get for you?\"" \""Pop,\"" goes the weasel. 	"
0,"How was the snow globe feeling after the storm? A little shaken. 	"
0,"Did you hear the one about the guy with the broken hearing aid? Neither did he. 	"
0,"Did you hear about the campsite that got visited by Bigfoot? It got in tents. 	"
0,"I saw a documentary on TV last night about how they put ships together.It was rivetting. 	"
0,"What did the Red light say to the Green light? Don't look at me I'm changing! 	"
0,"What did the ocean say to the beach? Thanks for all the sediment. 	"
0,"What did the left eye say to the right eye? Between us, something smells! 	"
0,"What do you call a fly without wings? A walk. 	"
0,"Why did the melons plan a big wedding? Because they cantaloupe! 	"
0,"Yesterday I confused the words \""jacuzzi\"" and \""yakuza\"". Now I'm in hot water with the Japanese mafia. 	"
0,"What is the least spoken language in the world? Sign Language 	"
0,"What do birds give out on Halloween? Tweets. 	"
0,"I used to think I was indecisive, but now I'm not sure. 	"
0,"Velcro… What a rip-off. 	"
0,"Have you heard the rumor going around about butter? Never mind, I shouldn't spread it. 	"
0,"Every morning when I go out, I get hit by bicycle. Every morning!It's a vicious cycle. 	"
0,"What happens to a frog's car when it breaks down? It gets toad. 	"
0,"I fear for the calendar, its days are numbered.	"
0,"I'm glad I know sign language, it's pretty handy. 	"
0,"The other day, my wife asked me to pass her lipstick but I accidentally passed her a glue stick. She still isn't talking to me. 	"
0,"What do you get when you cross a chicken with a skunk? A fowl smell! 	"
0,"Where do you take someone who’s been injured in a peek-a-boo accident? To the I.C.U. 	"
0,"As I get older, I think of all the people I lost along the way. Maybe a career as a tour guide wasn't such a good idea. 	"
0,"How many hipsters does it take to change a lightbulb? Oh, it's a really obscure number. You've probably never heard of it. 	"
0,"Where do sheep go to get their hair cut? The baa-baa shop. 	"
0,"Our wedding was so beautiful, even the cake was in tiers. 	"
0,"Why did the miner get fired from his job? He took it for granite... 	"
0,"What did the hat say to the scarf? You can hang around. I'll just go on ahead.	"
0,"Where do cats write notes? Scratch Paper! 	"
0,"Why is the new Kindle screen textured to look like paper? So you feel write at home. 	"
0,"When my wife told me to stop impersonating a flamingo, I had to put my foot down. 	"
0,"No matter how kind you are, German children are kinder. 	"
0,"What’s the advantage of living in Switzerland? Well, the flag is a big plus. 	"
0,"When I left school, I passed every one of my exams with the exception of Greek Mythology. It always was my achilles elbow 	"
0,"Why did the cookie cry? It was feeling crumby. 	"
0,"What did Yoda say when he saw himself in 4K? \""HDMI\"" 	"
0,"How do you make a 'one' disappear? You add a 'g' and it's 'gone' 	"
0,"Me and my mates are in a band called Duvet. We're a cover band. 	"
0,"Where do you learn to make banana splits? At sundae school. 	"
0,"Nurse: Doctor, there's a patient that says he's invisible. Doctor: Well, tell him I can't see him right now! 	"
0,"What was a more important invention than the first telephone? The second one. 	"
0,"What do you get when you cross a snowman with a vampire? Frostbite. 	"
0,"What do you do when your bunny gets wet? You get your hare dryer. 	"
0,"Did you know crocodiles could grow up to 15 feet? But most just have 4. 	"
0,"There are two types of people in this world, those who can extrapolate from incomplete data... 	"
0,"Why did the fireman wear red, white, and blue suspenders? To hold his pants up. 	"
0,"In the news a courtroom artist was arrested today, I'm not surprised, he always seemed sketchy. 	"
0,"I wanted to be a tailor but I didn't suit the job 	"
0,"What do you call someone with no nose? Nobody knows. 	"
0,"What do you call a girl between two posts? Annette. 	"
0,"What do you call a criminal going down the stairs? Condescending 	"
0,"What do you call a fat psychic? A four-chin teller. 	"
0,"I used to be a banker, but I lost interest. 	"
0,"Why can't a bicycle stand on its own? It's two-tired. 	"
0,"What does a pirate pay for his corn? A buccaneer! 	"
0,"Astronomers got tired watching the moon go around the earth for 24 hours. They decided to call it a day. 	"
0,"My dog used to chase people on a bike a lot. It got so bad I had to take his bike away. 	"
0,"I ate a clock yesterday. It was so time consuming. 	"
0,"Two dyslexics walk into a bra. 	"
0,"I been watching a channel on TV that is strictly just about origami — of course it is paper-view. 	"
0,"Milk is also the fastest liquid on earth – its pasteurized before you even see it 	"
0,"Is the pool safe for diving? It deep ends. 	"
0,"Why do scuba divers fall backwards into the water? Because if they fell forwards they’d still be in the boat. 	"
0,"My wife told me to rub the herbs on the meat for better flavor. That's sage advice. 	"
0,"A man was caught stealing in a supermarket today while balanced on the shoulders of a couple of vampires. He was charged with shoplifting on two counts.	"
0,"Ben & Jerry's really need to improve their operation. The only way to get there is down a rocky road. 	"
0,"How are false teeth like stars? They come out at night! 	"
0,"What time did the man go to the dentist? Tooth hurt-y. 	"
0,"I went to the zoo yesterday and saw a baguette in a cage. It was bread in captivity. 	"
0,"Did you hear about the cheese factory that exploded in France? There was nothing left but de Brie. 	"
0,"How does a penguin build it’s house? Igloos it together. 	"
0,"What is this movie about? It is about 2 hours long. 	"
0,"Why are pirates called pirates? Because they arrr! 	"
0,"Where does Fonzie like to go for lunch? Chick-Fil-Eyyyyyyyy. 	"
0,"How does a dyslexic poet write? Inverse. 	"
0,"Don't tell secrets in corn fields. Too many ears around. 	"
0,"What did the pirate say on his 80th birthday? Aye Matey! 	"
0,"Why did the A go to the bathroom and come out as an E? Because he had a vowel movement. 	"
0,"Yesterday a clown held a door open for me. I thought it was a nice jester. 	"
0,"Why did the opera singer go sailing? They wanted to hit the high Cs. 	"
0,"Bought a new jacket suit the other day and it burst into flames. Well, it was a blazer 	"
0,"Whats a penguins favorite relative? Aunt Arctica. 	"
0,"Never Trust Someone With Graph Paper...They're always plotting something. 	"
0,"What do you call an elephant that doesn’t matter? An irrelephant. 	"
0,"What do you call a group of disorganized cats? A cat-tastrophe. 	"
0,"What is bread's favorite number?Leaven. 	"
0,"Why can’t you hear a pterodactyl go to the bathroom? The p is silent. 	"
0,"How do you know if there’s an elephant under your bed? Your head hits the ceiling! 	"
0,"How do you teach a kid to climb stairs? There is a step by step guide. 	"
0,"Where do owls go to buy their baby clothes? The owlet malls. 	"
0,"Why does Norway have barcodes on their battleships? So when they get back to port, they can Scandinavian. 	"
0,"What's the worst part about being a cross-eyed teacher?They can't control their pupils. 	"
0,"What do you call a fashionable lawn statue with an excellent sense of rhythmn? A metro-gnome 	"
0,"Someone broke into my house last night and stole my limbo trophy. How low can you go? 	"
0,"Why did the coffee file a police report? It got mugged. 	"
0,"Mountains aren't just funny, they are hill areas 	"
0,"I was going to learn how to juggle, but I didn't have the balls. 	"
0,"The Swiss must've been pretty confident in their chances of victory if they included a corkscrew in their army knife. 	"
0,"Why was the strawberry sad? Its parents were in a jam. 	"
0,"I wear a stethoscope so that in a medical emergency I can teach people a valuable lesson about assumptions. 	"
0,"Why are ghosts bad liars? Because you can see right through them! 	"
0,"Every machine in the coin factory broke down all of a sudden without explanation. It just doesn’t make any cents. 	"
0,"Why does it take longer to get from 1st to 2nd base, than it does to get from 2nd to 3rd base? Because there’s a Shortstop in between! 	"
0,"What do you do when you see a space man? Park your car, man. 	"
0,"If you want a job in the moisturizer industry, the best advice I can give is to apply daily. 	"
0,"Where do you take someone who has been injured in a Peek-a-boo accident? To the I.C.U. 	"
0,"When you have a bladder infection, urine trouble. 	"
0,"How do you make Lady Gaga cry? Poker face.	"
0,"What do you call a group of killer whales playing instruments? An Orca-stra. 	"
0,"I was in an 80's band called the prevention. We were better than the cure. 	"
0,"What did Michael Jackson name his denim store?Billy Jeans! 	"
0,"People saying 'boo! to their friends has risen by 85% in the last year.... That's a frightening statistic. 	"
0,"Geology rocks, but Geography is where it's at! 	"
0,"Why does Han Solo like gum? It's chewy! 	"
0,"I was at the library and asked if they have any books on \""paranoia\"", the librarian replied, \""yes, they are right behind you\"" 	"
0,"Have you heard of the band 1023MB? They haven't got a gig yet. 	"
0,"The urge to sing the Lion King song is just a whim away. 	"
0,"What happens when you anger a brain surgeon? They will give you a piece of your mind. 	"
0,"I needed a password eight characters long so I picked Snow White and the Seven Dwarfs. 	"
0,"I used to work at a stationery store.But, I didn't feel like I was going anywhere.So, I got a job at a travel agency.Now, I know I'll be going places. 	"
0,"I used to work in a shoe recycling shop. It was sole destroying. 	"
0,"I used to hate facial hair, but then it grew on me. 	"
0,"R.I.P. boiled water. You will be mist. 	"
0,"Q: What did the spaghetti say to the other spaghetti? A: Pasta la vista, baby! 	"
0,"The first time I got a universal remote control I thought to myself, \""This changes everything\"" 	"
0,"Why is the ocean always blue? Because the shore never waves back. 	"
0,"Why did the feline fail the lie detector test? Because he be lion. 	"
0,"Why did the man put his money in the freezer? He wanted cold hard cash! 	"
0,"I decided to sell my Hoover… well it was just collecting dust. 	"
0,"Why do ducks make great detectives? They always quack the case. 	"
0,"What does a clock do when it's hungry? It goes back four seconds! 	"
0,"What do I look like? A JOKE MACHINE!? 	"
0,"I bought shoes from a drug dealer once. I don't know what he laced them with, but I was tripping all day. 	"
0,"What is a tornado's favorite game to play? Twister! 	"
0,"You know that cemetery up the road? People are dying to get in there. 	"
0,"Pie is $2.50 in Jamaica and $3.00 in The Bahamas. These are the pie-rates of the Caribbean. 	"
0,"What do you call a fish wearing a bowtie? Sofishticated. 	"
0,"Did you hear about the Mexican train killer? He had loco motives 	"
0,"Can I watch the TV? Dad: Yes, but don’t turn it on. 	"
0,"What is worse then finding a worm in your Apple? Finding half a worm in your Apple. 	"
0,"What do vegetarian zombies eat? Grrrrrainnnnnssss. 	"
0,"\""I'm sorry.\"" \""Hi sorry, I'm dad\"" 	"
0,"What is the hardest part about sky diving? The ground. 	"
0,"Why did the cowboy have a weiner dog? Somebody told him to get a long little doggy. 	"
0,"My friend keeps telling me \""Cheer up. You aren't stuck in a deep hole in the ground, filled with water.\"" I know he means well. 	"
0,"Who did the wizard marry? His ghoul-friend 	"
0,"How many seconds are in a year? 12. January 2nd, February 2nd, March 2nd, April 2nd.... etc 	"
0,"I ordered a chicken and an egg from Amazon. I'll let you know. 	"
0,"Ever wondered why bees hum? It's because they don't know the words. 	"
0,"How many optometrists does it take to change a light bulb? 1 or 2? 1... or 2? 	"
0,"There's not really any training for garbagemen. They just pick things up as they go. 	"
0,"Did you hear about the cow who jumped over the barbed wire fence? It was udder destruction. 	"
0,"I was shocked when I was diagnosed as colorblind... It came out of the purple. 	"
0,"Where does astronauts hangout after work? At the spacebar. 	"
0,"What do you call a bear with no teeth? A gummy bear! 	"
0,"I’ve deleted the phone numbers of all the Germans I know from my mobile phone. Now it’s Hans free. 	"
0,"What do you call your friend who stands in a hole? Phil. 	"
0,"A doll was recently found dead in a rice paddy. It's the only known instance of a nick nack paddy wack. 	"
0,"How do you tell the difference between a crocodile and an alligator? You will see one later and one in a while. 	"
0,"What do you call a fake noodle? An impasta. 	"
0,"The word queue is ironic. It's just q with a bunch of silent letters waiting in line. 	"
0,"What do you call a droid that takes the long way around? R2 detour. 	"
0,"What's the best thing about elevator jokes? They work on so many levels. 	"
0,"Where do rabbits go after they get married? On a bunny-moon. 	"
0,"Why do cows wear bells? Because their horns don't work. 	"
0,"Two fish are in a tank, one turns to the other and says, \""how do you drive this thing?\"" 	"
0,"I finally bought the limited edition Thesaurus that I've always wanted. When I opened it, all the pages were blank. I have no words to describe how angry I am. 	"
0,"This is my step ladder. I never knew my real ladder. 	"
0,"I was thinking about moving to Moscow but there is no point Russian into things. 	"
0,"A man walks into a bar and orders helicopter flavor chips. The barman replies \""sorry mate we only do plain\"" 	"
0,"It's been months since I bought the book \""how to scam people online\"". It still hasn't turned up. 	"
0,"Why is it a bad idea to iron your four-leaf clover? Cause you shouldn't press your luck. 	"
0,"I got an A on my origami assignment when I turned my paper into my teacher 	"
0,"What did the fish say when it swam into a wall? Damn! 	"
0,"I accidentally drank a bottle of invisible ink. Now I’m in hospital, waiting to be seen. 	"
0,"Why does Waldo only wear stripes? Because he doesn't want to be spotted. 	"
0,"My New Years resolution is to stop leaving things so late. 	"
0,"Why did the scarecrow win an award? Because he was outstanding in his field. 	"
0,"Americans can't switch from pounds to kilograms overnight. That would cause mass confusion. 	"
0,"An apple a day keeps the bullies away. If you throw it hard enough. 	"
0,"Why does Superman get invited to dinners? Because he is a Supperhero. 	"
0,"Why is no one friends with Dracula? Because he's a pain in the neck. 	"
0,"A man got hit in the head with a can of Coke, but he was alright because it was a soft drink. 	"
0,"What is the leading cause of dry skin? Towels 	"
0,"A man walked in to a bar with some asphalt on his arm. He said \""Two beers please, one for me and one for the road.\"" 	"
0,"Did you know the first French fries weren't actually cooked in France? They were cooked in Greece. 	"
0,"I’ll tell you something about German sausages, they’re the wurst 	"
0,"Where did Captain Hook get his hook? From a second hand store. 	"
0,"I got fired from a florist, apparently I took too many leaves. 	"
0,"Two silk worms had a race. They ended up in a tie. 	"
0,"I got fired from the transmission factor, turns out I didn't put on enough shifts... 	"
0,"Where do young cows eat lunch? In the calf-ateria. 	"
0,"I went to the doctor today and he told me I had type A blood but it was a type O. 	"
0,"How does a French skeleton say hello? Bone-jour. 	"
0,"Why was the big cat disqualified from the race? Because it was a cheetah. 	"
0,"What do prisoners use to call each other? Cell phones. 	"
0,"What’s E.T. short for? He’s only got little legs. 	"
0,"We all know where the Big Apple is but does anyone know where the Minneapolis? 	"
0,"What kind of award did the dentist receive? A little plaque. 	"
0,"Got a new suit recently made entirely of living plants. I wasn’t sure at first, but it’s grown on me 	"
0,"Do you know where you can get chicken broth in bulk? The stock market. 	"
0,"What's orange and sounds like a parrot? A Carrot. 	"
0,"A Sandwich walks into a bar, the bartender says \""Sorry, we don’t serve food here\"" 	"
0,"What do you get hanging from Apple trees? Sore arms. 	"
0,"I thought about going on an all-almond diet. But that's just nuts. 	"
0,"I don’t play soccer because I enjoy the sport. I’m just doing it for kicks. 	"
0,"People are shocked to discover I have a police record but I love their greatest hits! 	"
0,"Today a girl said she recognized me from vegetarian club, but I’m sure I’ve never met herbivore. 	"
0,"How do you organize a space party? You planet. 	"
0,"How do you make holy water? You boil the hell out of it. 	"
0,"A man is washing the car with his son. The son asks...... \""Dad, can’t you just use a sponge?\"" 	"
0,"They laughed when I said I wanted to be a comedian – they’re not laughing now. 	"
0,"What does an angry pepper do? It gets jalapeño face. 	"
0,"Don't buy flowers at a monastery. Because only you can prevent florist friars. 	"
0,"Hostess: Do you have a preference of where you sit? Dad: Down. 	"
0,"Did you hear about the submarine industry? It really took a dive... 	"
0,"The biggest knight at King Arthur's round table was Sir Cumference. He acquired his size from eating too much pi. 	"
0,"To the person who stole my anti-depressant pills: I hope you're happy now. 	"
0,"How do you get a baby alien to sleep?You rocket. 	"
0,"Why do pirates not know the alphabet? They always get stuck at \""C\"". 	"
0,"I saw my husband trip and fall while carrying a laundry basket full of ironed clothes. I watched it all unfold. 	"
0,"Did you hear about the chameleon who couldn't change color? They had a reptile dysfunction. 	"
0,"Why did the house go to the doctor? It was having window panes. 	"
